{
  "schema_version": "1.0.0",
  "matrix_id": "phase0.multilingual-fleurs-10-1",
  "captured_at": "2026-07-20T10:13:53.910Z",
  "source_revision": "254356ef94f3833d7dae40f68e6633de55af17dd",
  "fixture_manifest_revision": "phase0-multilingual-asr-1",
  "fixture_ids": [
    "fleurs-en-us-test-000",
    "fleurs-en-us-test-001",
    "fleurs-de-de-test-000",
    "fleurs-de-de-test-001",
    "fleurs-es-419-test-000",
    "fleurs-es-419-test-001",
    "fleurs-fr-fr-test-000",
    "fleurs-fr-fr-test-001",
    "fleurs-pt-br-test-000",
    "fleurs-pt-br-test-001"
  ],
  "host": {
    "id": "mac-studio-m1-ultra-local",
    "chip": "Apple M1 Ultra",
    "memory_bytes": 68719476736,
    "os": "macOS 26.5.2 (25F84)",
    "architecture": "arm64",
    "power_state": "unknown"
  },
  "procedure": {
    "repetitions": 2,
    "fixture_order": [
      "fleurs-en-us-test-000",
      "fleurs-en-us-test-001",
      "fleurs-de-de-test-000",
      "fleurs-de-de-test-001",
      "fleurs-es-419-test-000",
      "fleurs-es-419-test-001",
      "fleurs-fr-fr-test-000",
      "fleurs-fr-fr-test-001",
      "fleurs-pt-br-test-000",
      "fleurs-pt-br-test-001"
    ],
    "quality_normalization": "Unicode lowercase; punctuation and whitespace removed consistently with phase-0 single-fixture records",
    "cold_load": "First candidate-specific create or initialize value in a fresh process; system and model caches were not cleared",
    "warm_inference": "Mean complete inference after one discarded candidate-specific warm-up",
    "energy": "Not captured in this breadth pass; use the alternating powermetrics procedure documented in benchmarks/README.md"
  },
  "candidates": [
    {
      "id": "apple-speechtranscriber",
      "raw_artifact": "benchmarks/raw/phase0.apple-speech.multilingual-fleurs-10-1/result.json",
      "quality": {
        "macro_wer": 0.07575318009578433,
        "macro_cer": 0.033458277415178254,
        "by_language": {
          "en": {
            "fixture_count": 2,
            "macro_wer": 0.07393483709273183,
            "macro_cer": 0.023218294051627383
          },
          "de": {
            "fixture_count": 2,
            "macro_wer": 0.07539682539682539,
            "macro_cer": 0.019230769230769232
          },
          "es": {
            "fixture_count": 2,
            "macro_wer": 0.06152805949966193,
            "macro_cer": 0.02924472323472069
          },
          "fr": {
            "fixture_count": 2,
            "macro_wer": 0.017543859649122806,
            "macro_cer": 0.011904761904761904
          },
          "pt": {
            "fixture_count": 2,
            "macro_wer": 0.1503623188405797,
            "macro_cer": 0.08369283865401209
          }
        }
      },
      "timing": {
        "mean_cold_load_ms": 910.7837875000001,
        "minimum_cold_load_ms": 104.204542,
        "maximum_cold_load_ms": 1611.316334,
        "mean_warm_inference_ms": 189.46522285,
        "mean_real_time_factor": 0.013588005981002122
      },
      "resources": {
        "maximum_peak_memory_bytes": 24002560,
        "runtime_peak_memory_bytes": null,
        "model_size_bytes": null,
        "binary_size_bytes": 950776
      },
      "streaming": {
        "supported": true,
        "mean_first_result_ms": 52.1448395,
        "timestamps": "word"
      },
      "disposition": "primary"
    },
    {
      "id": "whisper-large-v3-turbo-coreml-whispercpp",
      "raw_artifact": "benchmarks/raw/phase0.whisper.multilingual-fleurs-10-1/result.json",
      "quality": {
        "macro_wer": 0.05614368659691973,
        "macro_cer": 0.012473676936499922,
        "by_language": {
          "en": {
            "fixture_count": 2,
            "macro_wer": 0.15288220551378445,
            "macro_cer": 0.03556397306397306
          },
          "de": {
            "fixture_count": 2,
            "macro_wer": 0.047619047619047616,
            "macro_cer": 0
          },
          "es": {
            "fixture_count": 2,
            "macro_wer": 0.027045300878972278,
            "macro_cer": 0.005538131163290102
          },
          "fr": {
            "fixture_count": 2,
            "macro_wer": 0.017543859649122806,
            "macro_cer": 0.011904761904761904
          },
          "pt": {
            "fixture_count": 2,
            "macro_wer": 0.035628019323671496,
            "macro_cer": 0.009361518550474547
          }
        }
      },
      "timing": {
        "mean_cold_load_ms": 863.4871290000001,
        "minimum_cold_load_ms": 828.7012500000001,
        "maximum_cold_load_ms": 963.9973749999999,
        "mean_warm_inference_ms": 774.2494812,
        "mean_real_time_factor": 0.05636377501151504
      },
      "resources": {
        "maximum_peak_memory_bytes": 2002911232,
        "runtime_peak_memory_bytes": null,
        "model_size_bytes": 2899675450,
        "binary_size_bytes": 2172752
      },
      "streaming": {
        "supported": false,
        "mean_first_result_ms": null,
        "timestamps": "segment"
      },
      "disposition": "fallback"
    },
    {
      "id": "parakeet-tdt-0.6b-v3-coreml",
      "raw_artifact": "benchmarks/raw/phase0.parakeet.multilingual-fleurs-10-1/result.json",
      "quality": {
        "macro_wer": 0.10274297467218034,
        "macro_cer": 0.04746741831945989,
        "by_language": {
          "en": {
            "fixture_count": 2,
            "macro_wer": 0.23182957393483708,
            "macro_cer": 0.152847923681257
          },
          "de": {
            "fixture_count": 2,
            "macro_wer": 0.13095238095238093,
            "macro_cer": 0.028846153846153848
          },
          "es": {
            "fixture_count": 2,
            "macro_wer": 0.027045300878972278,
            "macro_cer": 0.007530163035800062
          },
          "fr": {
            "fixture_count": 2,
            "macro_wer": 0.05263157894736842,
            "macro_cer": 0.02119309262166405
          },
          "pt": {
            "fixture_count": 2,
            "macro_wer": 0.07125603864734299,
            "macro_cer": 0.026919758412424506
          }
        }
      },
      "timing": {
        "mean_cold_load_ms": 214.18480010000002,
        "minimum_cold_load_ms": 200.555583,
        "maximum_cold_load_ms": 299.94437500000004,
        "mean_warm_inference_ms": 249.84328754999993,
        "mean_real_time_factor": 0.01761471837227486
      },
      "resources": {
        "maximum_peak_memory_bytes": 153616384,
        "runtime_peak_memory_bytes": null,
        "model_size_bytes": 1899782094,
        "binary_size_bytes": 133472
      },
      "streaming": {
        "supported": false,
        "mean_first_result_ms": null,
        "timestamps": "segment"
      },
      "disposition": "compatibility-baseline"
    },
    {
      "id": "mlx-whisper-tiny",
      "raw_artifact": "benchmarks/raw/phase0.mlx.multilingual-fleurs-10-1/result.json",
      "quality": {
        "macro_wer": 0.26241612350245336,
        "macro_cer": 0.076058202974202,
        "by_language": {
          "en": {
            "fixture_count": 2,
            "macro_wer": 0.12155388471177944,
            "macro_cer": 0.04026374859708193
          },
          "de": {
            "fixture_count": 2,
            "macro_wer": 0.4126984126984127,
            "macro_cer": 0.06255401901469318
          },
          "es": {
            "fixture_count": 2,
            "macro_wer": 0.1940500338066261,
            "macro_cer": 0.047173010087310334
          },
          "fr": {
            "fixture_count": 2,
            "macro_wer": 0.24561403508771928,
            "macro_cer": 0.09419152276295134
          },
          "pt": {
            "fixture_count": 2,
            "macro_wer": 0.3381642512077294,
            "macro_cer": 0.13610871440897326
          }
        }
      },
      "timing": {
        "mean_cold_load_ms": 69.1878,
        "minimum_cold_load_ms": 64.688,
        "maximum_cold_load_ms": 93.451,
        "mean_warm_inference_ms": 284.75755,
        "mean_real_time_factor": 0.01841406763070184
      },
      "resources": {
        "maximum_peak_memory_bytes": 130580480,
        "runtime_peak_memory_bytes": 285849296,
        "model_size_bytes": 74418182,
        "binary_size_bytes": 148839360
      },
      "streaming": {
        "supported": false,
        "mean_first_result_ms": null,
        "timestamps": "segment"
      },
      "disposition": "research"
    }
  ],
  "recommendation": {
    "primary": "apple-speechtranscriber",
    "fallback": "whisper-large-v3-turbo-coreml-whispercpp",
    "research": [
      "mlx-whisper-tiny"
    ],
    "rationale": [
      "Apple SpeechTranscriber is the first vertical-slice backend because it combines 7.58% macro WER with the lowest warm latency and process RSS, real incremental results, and word timestamps.",
      "Whisper large-v3-turbo is the opt-in quality and coverage fallback because it has the best measured WER, but its 2.90 GB model, 2.00 GB peak RSS, 774 ms warm latency, and batch-only output make it a poor default.",
      "Parakeet remains a compatibility baseline because it is less accurate than Apple SpeechTranscriber on this matrix without adding streaming or a smaller materialized model.",
      "Direct official MLX remains a first-class research foundation; Whisper Tiny proves the boundary but its multilingual quality is not sufficient for product selection."
    ]
  },
  "limitations": [
    "Two fixtures per language expose language-path failures but are not statistically sufficient for a final quality ranking.",
    "Energy was not measured because the documented powermetrics procedure requires privileged, alternating runs.",
    "Cold-load measurements use warm system and model caches and are not clean-host startup measurements.",
    "Candidate order was not alternated, so thermal and background-load effects were not controlled."
  ]
}
